### ISSUE TITLE
Can't log in

### ISSUE THREAD

**Issue by gozdal** [streetcomplete/StreetComplete#2344]
I can't login to my OpenStreetMap account. The login screen is empty and red progress bar at the top keeps spinning:

![Screenshot_20201204-101220_StreetComplete](https://user-images.githubusercontent.com/619444/101144903-ebe59380-3610-11eb-87b8-770bfc10b009.jpg)

**How to Reproduce**

Click "My profile"

**Versions affected**

StreetComplete v27.0
Samsung S8 
Android 9, One UI 1.0 (latest update from Oct 2020)

**Comment by matkoniecz** [comment]
Is https://www.openstreetmap.org/ loading in your phone browser? If yes, can you try again to login in StreetComplete?

I had this kind of effect due to a poor internet signal.

**Comment by gozdal** [comment]
Yes, everything's working fine otherwise (i.e. I have good Internet connectivity).

**Comment by matkoniecz** [comment]
But is https://www.openstreetmap.org/ website working on your phone at the same time as SC login is not working?

For example, internet may work in general but OSM website may be temporarily offline or unavailable for some other reason.

**Comment by gozdal** [comment]
Yes, it's working fine in Firefox, Chromium and in Chrome on the same phone, at the same time.

**Comment by westnordost** [comment]
Did it ever work for you before? 

On 4 December 2020 12:35:26 CET, Marcin Gozdalik <notifications@github.com> wrote:
>Yes, it's working fine in Firefox, Chromium and in Chrome on the same
>phone, at the same time.
>
>-- 
>You are receiving this because you are subscribed to this thread.
>Reply to this email directly or view it on GitHub:
>https://github.com/westnordost/StreetComplete/issues/2344#issuecomment-738735746

-- 
Diese Nachricht wurde von meinem Android-Gerät mit K-9 Mail gesendet.

**Comment by gozdal** [comment]
No, I've installed the app recently and was never able to login.

**Comment by gozdal** [comment]
I do have some limited Android developer experience, can attach LogCat and see what's there but you'd need to guide me what to look for - the logs are overwhelmingly huge.

**Comment by westnordost** [comment]
> can attach LogCat

Can you? I think that only works if you have rooted your device. But if you can, search for `OAuthDialogFragment`

**Comment by westnordost** [comment]
What you can also try is if you can find another app which displays a webview, maybe one where you can insert the address yourself and see if that works. I also suspect that your webview is somehow misbehaving. The WebView is essentially an app on your smartphone that is regularly updated from the Google Play store. Maybe you can check if for some reason the WebView didn't update anymore and you are sitting on an ancient WebView version that has some issues with for example certain HTTPS certificates.

**Comment by gozdal** [comment]
I don't have any other weird problems with apps on the phone. According to Developer Options my WebView is "Chrome 86.0.4240.198" which I believe is the latest Chrome there is. "Android System Webview" is grayed out and disabled.

I don't see anything about "OAuthDialogFragment". 

I'm using [LogCat app](https://www.f-droid.org/en/packages/com.dp.logcatapp/) (grepped for `webview` and later for `1762`):
```
[12-04 15:45:46.325 3827:3845 I/ActivityManager]
Start proc 1762:com.android.chrome:sandboxed_process0/u0i309 for webview_service de.westnordost.streetcomplete/org.chromium.content.app.SandboxedProcessService0

[12-04 15:45:46.327 1762:1762 E/Zygote]
accessInfo : 0

[12-04 15:45:46.365 1762:1762 E/dboxed_process]
Not starting debugger since process cannot load the jdwp agent.

[12-04 15:45:46.496 3827:5424 D/MultiDisplayManager]
init process display: set packageProcessId, displayId=0, same_package_proc=ProcessRecord{4fc61bad0 1640:de.westnordost.streetcomplete/u0a349}, app=ProcessRecord{68c2750d0 1762:com.android.chrome:sandboxed_process0/u0a349i309}

[12-04 15:45:46.681 1762:1762 I/LoadedApk]
No resource references to update in package com.android.chrome.autofill_assistant

[12-04 15:45:46.682 1762:1762 I/LoadedApk]
No resource references to update in package com.android.chrome.vr

[12-04 15:45:46.724 1762:1762 I/cr_ChildProcessService]
Creating new ChildProcessService pid=1762
```

**Comment by westnordost** [comment]
The log contains no interesting information. As far as I know, on a non-rooted device (i.e. without grating logcat root permissions) an app can only read its own logs.
I installed the app to see. Did you follow the instructions at the beginning, that involving the "`adb shell pm grant ...`" stuff?

**Comment by gozdal** [comment]
Yes, I used `adb` and the app shows a lot of logs, definitely more than just its own logs.

**Comment by westnordost** [comment]
Hmm okay, not sure how to continue here. If the webview seems to keep on loading, it should eventually run in a timeout I'd venture. Does it ever? (timeout time might be as high as five minutes, not sure right now)

**Comment by westnordost** [comment]
Do you have android studio?

**Comment by matkoniecz** [comment]
> the logs are overwhelmingly huge.

It is "overwhelmingly huge." as in "5 MB file of logs" or as in "50 GB file of logs"? If it the second case, then clearing them and capturing just new may help.

Maybe it would be OK to send log file to @westnordost ( https://github.com/westnordost/StreetComplete/issues/2245#issuecomment-723450267 )?

Or publish them at https://gist.github.com/ ?

Note that full logs will include your exact location, as reported by phone (what can be avoided by enabling location override in developer settings of Android).

**Comment by westnordost** [comment]
@matkoniecz your comment is unnecessary, he already looked at the logs through his app and didn't find anything

**Comment by westnordost** [comment]
If you have, you can help by telling me through which breakpoint the auth process passes and through which it doesn't.

![image](https://user-images.githubusercontent.com/4661658/101200692-f5014f80-3666-11eb-9e13-f8c9996e7104.png)

**Comment by westnordost** [comment]
@gozdal ? Are you up for it? Because otherwise I don't really know how to help your login problem. Needless to say, you are the first person for whom it is not working, so I also have no clue where to look for a problem.

**Comment by gozdal** [comment]
I've written an Android app, but it was veeeery long time ago, sometimes around Android 4. 
I did install latest Android Studio (on Windows) and imported https://github.com/streetcomplete/StreetComplete. I get 
![obraz](https://user-images.githubusercontent.com/619444/102023068-d85dc980-3d82-11eb-9041-3d89bfe43400.png)
Not sure how to proceed.

**Comment by westnordost** [comment]
Here is a short tutorial on this:
http://www.allenconway.net/2017/11/accepting-android-sdk-license-via.html

Basically, what should have happened when Android Studio downloaded the build tools v29.0.2 for you, you should have gotten a popup asking you to accept the agreement. If you don't want to solve this via command line, you could try to deinstall the build tools again (Tools->SDK Manager) and then reinstall them. Android Studio should certainly ask again for you to accept them.

**Comment by gozdal** [comment]
Thanks, that helped.
After downloading half of the Internet, burning my processor for 15 minutes I managed to run the code from under Android Studio on my Samsung. Good thing is that it shows the same behavior - login screen is empty.
Would you be able to give me instructions on how to debug the issue?

**Comment by gozdal** [comment]
OK, I've somehow missed your guide where to put breakpoints to debug. Let me see....

**Comment by gozdal** [comment]
Hit https://github.com/streetcomplete/StreetComplete/blob/b4485eac89491f9617996a366423919bed461710/app/src/main/java/de/westnordost/streetcomplete/settings/OAuthFragment.kt#L119 did Step Over and got to https://github.com/streetcomplete/StreetComplete/blob/b4485eac89491f9617996a366423919bed461710/app/src/main/java/de/westnordost/streetcomplete/settings/OAuthFragment.kt#L120

"Step Over" doesn't finish and I see empty screen and cycling progress bar.

**Comment by gozdal** [comment]
OK, putting breakpoint in https://github.com/streetcomplete/StreetComplete/blob/b4485eac89491f9617996a366423919bed461710/app/src/main/java/de/westnordost/streetcomplete/settings/OAuthFragment.kt#L121

and stepping into 
https://github.com/mttkay/signpost/blob/2a2a5319b236ff2e1c2eee310f7469011246a83c/signpost-core/src/main/java/oauth/signpost/AbstractOAuthProvider.java#L60

`consumer` is `DefaultOAuthConsumer`
`callbackUrl` is `streetcomplete://oauth`
`customOAuthParams` is `{}`

The call which hangs is https://github.com/mttkay/signpost/blob/2a2a5319b236ff2e1c2eee310f7469011246a83c/signpost-core/src/main/java/oauth/signpost/AbstractOAuthProvider.java#L74

**Comment by gozdal** [comment]
Stepping into:
https://github.com/mttkay/signpost/blob/2a2a5319b236ff2e1c2eee310f7469011246a83c/signpost-core/src/main/java/oauth/signpost/AbstractOAuthProvider.java#L150
`endpointUrl` is `https://www.openstreetmap.org/oauth/request_token`

https://github.com/mttkay/signpost/blob/2a2a5319b236ff2e1c2eee310f7469011246a83c/signpost-core/src/main/java/oauth/signpost/AbstractOAuthProvider.java#L181

doesn't return :/

**Comment by gozdal** [comment]
OK, I think I understand the issue. It seems it has little to do with your app.
Most of the time I'm connected to IPv6-enabled networks. `openstreetmap.org` is advertising AAAA in DNS:
```
gozdal@X1Gozdala:~$ host -t aaaa www.openstreetmap.org
www.openstreetmap.org has IPv6 address 2001:978:2:2c::172:d
www.openstreetmap.org has IPv6 address 2001:978:2:2c::172:b
www.openstreetmap.org has IPv6 address 2001:978:2:2c::172:c
```
However, IPv6 hosts do not seem to work:
```
root@fritz:~# tcpdump -i any -s0 host www.openstreetmap.org
tcpdump: verbose output suppressed, use -v or -vv for full protocol decode
listening on any, link-type LINUX_SLL (Linux cooked v1), capture size 262144 bytes
23:00:17.515456 IP6 2001:470:6249:3147:d0a5:ca94:7a61:8fcb.49978 > 2001:978:2:2c::172:c.443: Flags [S], seq 227552586, win 65535, options [mss 1220,sackOK,TS val 13758408 ecr 0,nop,wscale 7], length 0
23:00:17.515637 IP6 2001:470:6249:3147:d0a5:ca94:7a61:8fcb.49978 > 2001:978:2:2c::172:c.443: Flags [S], seq 227552586, win 65535, options [mss 1220,sackOK,TS val 13758408 ecr 0,nop,wscale 7], length 0
23:00:33.547213 IP6 2001:470:6249:3147:d0a5:ca94:7a61:8fcb.49978 > 2001:978:2:2c::172:c.443: Flags [S], seq 227552586, win 65535, options [mss 1220,sackOK,TS val 13762416 ecr 0,nop,wscale 7], length 0
23:00:33.547410 IP6 2001:470:6249:3147:d0a5:ca94:7a61:8fcb.49978 > 2001:978:2:2c::172:c.443: Flags [S], seq 227552586, win 65535, options [mss 1220,sackOK,TS val 13762416 ecr 0,nop,wscale 7], length 0
23:01:05.215224 IP6 2001:470:6249:3147:d0a5:ca94:7a61:8fcb.49988 > 2001:978:2:2c::172:c.443: Flags [S], seq 3884898474, win 65535, options [mss 1220,sackOK,TS val 13770326 ecr 0,nop,wscale 7], length 0
23:01:05.215431 IP6 2001:470:6249:3147:d0a5:ca94:7a61:8fcb.49988 > 2001:978:2:2c::172:c.443: Flags [S], seq 3884898474, win 65535, options [mss 1220,sackOK,TS val 13770326 ecr 0,nop,wscale 7], length 0
23:01:05.612828 IP6 2001:470:6249:3147:d0a5:ca94:7a61:8fcb.49978 > 2001:978:2:2c::172:c.443: Flags [S], seq 227552586, win 65535, options [mss 1220,sackOK,TS val 13770432 ecr 0,nop,wscale 7], length 0
23:01:05.613026 IP6 2001:470:6249:3147:d0a5:ca94:7a61:8fcb.49978 > 2001:978:2:2c::172:c.443: Flags [S], seq 227552586, win 65535, options [mss 1220,sackOK,TS val 13770432 ecr 0,nop,wscale 7], length 0
23:01:06.189355 IP6 2001:470:6249:3147:d0a5:ca94:7a61:8fcb.49988 > 2001:978:2:2c::172:c.443: Flags [S], seq 3884898474, win 65535, options [mss 1220,sackOK,TS val 13770576 ecr 0,nop,wscale 7], length 0
```

Browsers use [Happy Eyeballs](https://en.wikipedia.org/wiki/Happy_Eyeballs) algorithm which connects to IPv4 or IPv6, whichever responds first. That's why I was always able to load the login screen in browser app on the phone (Chrome/Chromium/Firefox).
However, for some reason, this behavior does not work with WebView - so in IPv6-enabled network the login screen never loads within the app.

Ideally WebView should use Happy Eyeballs but I don't know how to enforce it.
Do you know how to notify `openstreetmap.org` maintainers that their IPv6 addresses do not work?

**Comment by HolgerJeromin** [comment]
Do other v6 hosts work for you?
eg https://ipv6-test.com/

**Comment by westnordost** [comment]
Thank you for your effort!

Okay, so it looks like not the WebView is the problem but how the Signpost library does requests.

I am surprised that the consumer is `DefaultOAuthConsumer` because I remember reading this https://github.com/mttkay/signpost#google-android and doing something about it. Apparently, I didn't after all.

I am preparing a fix that I'll commit in a moment. You could check if it works then!

**Comment by westnordost** [comment]
I did this now. Would you like to try if the head of master works for you?

**Comment by westnordost** [comment]
in https://github.com/streetcomplete/StreetComplete/commit/f7baaa6de99d46acfbbdc3016fc4dc1876679bad

**Comment by gozdal** [comment]
> 
> 
> Do other v6 hosts work for you?
> eg https://ipv6-test.com/

Yes
![obraz](https://user-images.githubusercontent.com/619444/102059792-4c32bd00-3de9-11eb-90c4-5e9e54977a15.png)

**Comment by gozdal** [comment]
It works!. It prefers IPv6 but after 30 seconds it gives up and switched to IPv4:
```
root@fritz:~# tcpdump -i any host www.openstreetmap.org
tcpdump: verbose output suppressed, use -v or -vv for full protocol decode
listening on any, link-type LINUX_SLL (Linux cooked v1), capture size 262144 bytes
10:02:51.404932 IP6 2001:470:xxxxxxxxxxxxxxxxxxxxxxxxxxxxx.35380 > 2001:978:2:2c::172:d.443: Flags [S], seq 2019967915, win 65535, options [mss 1220,sackOK,TS val 17459972 ecr 0,nop,wscale 7], length 0
10:02:51.405112 IP6 2001:470:xxxxxxxxxxxxxxxxxxxxxxxxxxxxx.35380 > 2001:978:2:2c::172:d.443: Flags [S], seq 2019967915, win 65535, options [mss 1220,sackOK,TS val 17459972 ecr 0,nop,wscale 7], length 0
10:02:52.402950 IP6 2001:470:xxxxxxxxxxxxxxxxxxxxxxxxxxxxx.35380 > 2001:978:2:2c::172:d.443: Flags [S], seq 2019967915, win 65535, options [mss 1220,sackOK,TS val 17460222 ecr 0,nop,wscale 7], length 0
10:02:52.403100 IP6 2001:470:xxxxxxxxxxxxxxxxxxxxxxxxxxxxx.35380 > 2001:978:2:2c::172:d.443: Flags [S], seq 2019967915, win 65535, options [mss 1220,sackOK,TS val 17460222 ecr 0,nop,wscale 7], length 0
10:02:54.425232 IP6 2001:470:xxxxxxxxxxxxxxxxxxxxxxxxxxxxx.35380 > 2001:978:2:2c::172:d.443: Flags [S], seq 2019967915, win 65535, options [mss 1220,sackOK,TS val 17460723 ecr 0,nop,wscale 7], length 0
10:02:54.425378 IP6 2001:470:xxxxxxxxxxxxxxxxxxxxxxxxxxxxx.35380 > 2001:978:2:2c::172:d.443: Flags [S], seq 2019967915, win 65535, options [mss 1220,sackOK,TS val 17460723 ecr 0,nop,wscale 7], length 0
10:02:58.420214 IP6 2001:470:xxxxxxxxxxxxxxxxxxxxxxxxxxxxx.35380 > 2001:978:2:2c::172:d.443: Flags [S], seq 2019967915, win 65535, options [mss 1220,sackOK,TS val 17461724 ecr 0,nop,wscale 7], length 0
10:02:58.420372 IP6 2001:470:xxxxxxxxxxxxxxxxxxxxxxxxxxxxx.35380 > 2001:978:2:2c::172:d.443: Flags [S], seq 2019967915, win 65535, options [mss 1220,sackOK,TS val 17461724 ecr 0,nop,wscale 7], length 0
10:03:01.427857 IP6 2001:470:xxxxxxxxxxxxxxxxxxxxxxxxxxxxx.53116 > 2001:978:2:2c::172:c.443: Flags [S], seq 2530470075, win 65535, options [mss 1220,sackOK,TS val 17462476 ecr 0,nop,wscale 7], length 0
10:03:01.428046 IP6 2001:470:xxxxxxxxxxxxxxxxxxxxxxxxxxxxx.53116 > 2001:978:2:2c::172:c.443: Flags [S], seq 2530470075, win 65535, options [mss 1220,sackOK,TS val 17462476 ecr 0,nop,wscale 7], length 0
10:03:02.426861 IP6 2001:470:xxxxxxxxxxxxxxxxxxxxxxxxxxxxx.53116 > 2001:978:2:2c::172:c.443: Flags [S], seq 2530470075, win 65535, options [mss 1220,sackOK,TS val 17462726 ecr 0,nop,wscale 7], length 0
10:03:02.427014 IP6 2001:470:xxxxxxxxxxxxxxxxxxxxxxxxxxxxx.53116 > 2001:978:2:2c::172:c.443: Flags [S], seq 2530470075, win 65535, options [mss 1220,sackOK,TS val 17462726 ecr 0,nop,wscale 7], length 0
10:03:04.435052 IP6 2001:470:xxxxxxxxxxxxxxxxxxxxxxxxxxxxx.53116 > 2001:978:2:2c::172:c.443: Flags [S], seq 2530470075, win 65535, options [mss 1220,sackOK,TS val 17463227 ecr 0,nop,wscale 7], length 0
10:03:04.435213 IP6 2001:470:xxxxxxxxxxxxxxxxxxxxxxxxxxxxx.53116 > 2001:978:2:2c::172:c.443: Flags [S], seq 2530470075, win 65535, options [mss 1220,sackOK,TS val 17463227 ecr 0,nop,wscale 7], length 0
10:03:08.426987 IP6 2001:470:xxxxxxxxxxxxxxxxxxxxxxxxxxxxx.53116 > 2001:978:2:2c::172:c.443: Flags [S], seq 2530470075, win 65535, options [mss 1220,sackOK,TS val 17464228 ecr 0,nop,wscale 7], length 0
10:03:08.427153 IP6 2001:470:xxxxxxxxxxxxxxxxxxxxxxxxxxxxx.53116 > 2001:978:2:2c::172:c.443: Flags [S], seq 2530470075, win 65535, options [mss 1220,sackOK,TS val 17464228 ecr 0,nop,wscale 7], length 0
10:03:11.450126 IP6 2001:470:xxxxxxxxxxxxxxxxxxxxxxxxxxxxx.34860 > 2001:978:2:2c::172:b.443: Flags [S], seq 3430811208, win 65535, options [mss 1220,sackOK,TS val 17464981 ecr 0,nop,wscale 7], length 0
10:03:11.450302 IP6 2001:470:xxxxxxxxxxxxxxxxxxxxxxxxxxxxx.34860 > 2001:978:2:2c::172:b.443: Flags [S], seq 3430811208, win 65535, options [mss 1220,sackOK,TS val 17464981 ecr 0,nop,wscale 7], length 0
10:03:12.450049 IP6 2001:470:xxxxxxxxxxxxxxxxxxxxxxxxxxxxx.34860 > 2001:978:2:2c::172:b.443: Flags [S], seq 3430811208, win 65535, options [mss 1220,sackOK,TS val 17465232 ecr 0,nop,wscale 7], length 0
10:03:12.450188 IP6 2001:470:xxxxxxxxxxxxxxxxxxxxxxxxxxxxx.34860 > 2001:978:2:2c::172:b.443: Flags [S], seq 3430811208, win 65535, options [mss 1220,sackOK,TS val 17465232 ecr 0,nop,wscale 7], length 0
10:03:14.458375 IP6 2001:470:xxxxxxxxxxxxxxxxxxxxxxxxxxxxx.34860 > 2001:978:2:2c::172:b.443: Flags [S], seq 3430811208, win 65535, options [mss 1220,sackOK,TS val 17465733 ecr 0,nop,wscale 7], length 0
10:03:14.458524 IP6 2001:470:xxxxxxxxxxxxxxxxxxxxxxxxxxxxx.34860 > 2001:978:2:2c::172:b.443: Flags [S], seq 3430811208, win 65535, options [mss 1220,sackOK,TS val 17465733 ecr 0,nop,wscale 7], length 0
10:03:18.460742 IP6 2001:470:xxxxxxxxxxxxxxxxxxxxxxxxxxxxx.34860 > 2001:978:2:2c::172:b.443: Flags [S], seq 3430811208, win 65535, options [mss 1220,sackOK,TS val 17466736 ecr 0,nop,wscale 7], length 0
10:03:18.460891 IP6 2001:470:xxxxxxxxxxxxxxxxxxxxxxxxxxxxx.34860 > 2001:978:2:2c::172:b.443: Flags [S], seq 3430811208, win 65535, options [mss 1220,sackOK,TS val 17466736 ecr 0,nop,wscale 7], length 0
10:03:21.473280 IP xxx.static.ip.netia.com.pl.33326 > 130.117.76.12.443: Flags [S], seq 2873914792, win 65535, options [mss 1460,sackOK,TS val 17467487 ecr 0,nop,wscale 7], length 0
10:03:21.501504 IP 130.117.76.12.443 > xxx.static.ip.netia.com.pl.33326: Flags [S.], seq 661949355, ack 2873914793, win 43440, options [mss 1460,sackOK,TS val 2797390153 ecr 17467487,nop,wscale 9], length 0
10:03:21.501550 IP 130.117.76.12.443 > xxx.static.ip.netia.com.pl.33326: Flags [S.], seq 661949355, ack 2873914793, win 43440, options [mss 1460,sackOK,TS val 2797390153 ecr 17467487,nop,wscale 9], length 0
```

**Comment by westnordost** [comment]
But can you download quests and upload changes?

**Comment by westnordost** [comment]
Because for downloading and uploading, also openstreetmap.org is contacted.

Maybe it is better to solve this problem at its roots. If I understand correctly, openstreetmap.org advertises wrongly that it supports IPv6 and it should not advertise it if it doesn't? Anyway, the issue tracker for issues with operations is here:

https://github.com/openstreetmap/operations/issues/new

Maybe you could create a bug there because I am not that well versed in the details around DNS, IP etc so you will be able to explain better what is the problem.

**Comment by gozdal** [comment]
> But can you download quests and upload changes?

Yes, did almost 100 quests yesterday :)

**Comment by gozdal** [comment]
> Because for downloading and uploading, also openstreetmap.org is contacted.

If system HTTP client is used for that I guess this should woek because of Happy Eyeballs.

> Maybe it is better to solve this problem at its roots. If I understand correctly, openstreetmap.org advertises wrongly that it supports IPv6 and it should not advertise it if it doesn't? Anyway, the issue tracker for issues with operations is here:
> 
> https://github.com/openstreetmap/operations/issues/new

Will do, thanks. Sent this report to `dev` mailing list but I guess this will be a better place.

**Comment by westnordost** [comment]
>If system HTTP client is used for that I guess this should woek because of Happy Eyeballs.

Well actually, for both the system HTTP client is used. So I am a bit puzzled.

**Comment by gozdal** [comment]
> > If system HTTP client is used for that I guess this should woek because of Happy Eyeballs.
> 
> Well actually, for both the system HTTP client is used. So I am a bit puzzled.

I thought that quoted https://github.com/mttkay/signpost#google-android:
> IMPORTANT: Do NOT use the DefaultOAuth* implementations on Android, since there's a bug in Android's java.net.HttpURLConnection that keeps it from working with some service providers. Instead, use the CommonsHttpOAuth* classes, since they are meant to be used with Apache Commons HTTP (that's what Android uses for HTTP anyway).

solves this - Android's java.net.HttpURLConnection has a bug (no Happy Eyeballs maybe?) and Apache Commons HTTP is fine?

**Comment by westnordost** [comment]
I'm using OkHttp only for OAuth right now (on master). For the rest, all just normal `java.net.HttpURLConnection`

**Comment by westnordost** [comment]
Anyway, since it works for you now (even though we do not know exactly why - i.e. why downloading/uploading works), this can be closed, right?
